id,cfu,parte,topic,question,opt_a,opt_b,opt_c,correct,source,explanation
489,9,1,lcv,Cos'è l'euristica del valore meno vincolante (Least Constraining Value)?,sceglie il valore che elimina più opzioni ai vicini,"sceglie il valore che elimina il minor numero di opzioni dai domini dei vicini, lasciando più flessibilità",sceglie la variabile con meno valori residui,b,flashcard_ia,"LCV = il valore che «disturba» meno i vicini, per tenere aperte più strade. Eliminare più opzioni è l'opposto; scegliere la variabile è compito di MRV/degree (LCV sceglie il VALORE)."
490,9,1,propagazione_vincoli,Cos'è la propagazione dei vincoli (inferenza) nei CSP?,aumentare i domini aggiungendo nuovi valori,assegnare valori a caso e verificare solo alla fine,"usare i vincoli per ridurre i domini eliminando valori incompatibili, alternando ricerca e inferenza",c,flashcard_ia,"Propagazione = restringere i domini togliendo valori impossibili, intrecciando ricerca e inferenza. Non è assegnare a caso né ampliare i domini (li si riduce)."
491,9,1,forward_checking,Cos'è il Forward Checking?,controlla tutti i vincoli tra tutte le variabili a ogni passo,"dopo ogni assegnamento, elimina dai domini dei vicini diretti i valori diventati incompatibili",torna indietro alla variabile in conflitto,b,flashcard_ia,"Forward checking: assegnata X, pota i domini dei suoi vicini diretti. Non propaga oltre i vicini (quello è AC-3) e non è backtracking."
492,9,1,forward_checking_limiti,Quali sono i limiti del forward checking?,"propaga su tutto il grafo, quindi è troppo lento","controlla solo i vincoli tra la variabile appena assegnata e i vicini diretti, non propaga ai vicini dei vicini",non riduce mai i domini,b,flashcard_ia,"FC guarda solo i vicini immediati: non vede inconsistenze più profonde (vicini dei vicini), che coglie invece l'arc consistency. Riduce eccome i domini, ma non abbastanza."
493,9,1,node_consistency,Cos'è la Node Consistency?,riguarda i vincoli binari tra coppie di variabili,una variabile è node-consistent se tutti i valori del suo dominio rispettano i vincoli UNARI su di essa,riguarda triple di variabili,b,flashcard_ia,"Node consistency = vincoli UNARI: si epurano dal dominio i valori che violano un vincolo su una sola variabile. I binari sono l'arc consistency, le triple la path consistency."
494,9,1,arc_consistency,Cos'è la Arc Consistency?,garantisce sempre l'esistenza di una soluzione,un arco X→Y è consistente se per ogni valore di X esiste almeno un valore di Y che soddisfa il vincolo; riguarda i vincoli binari,riguarda solo i vincoli unari,b,flashcard_ia,"Arc consistency (vincoli binari): ogni valore di X ha un «supporto» in Y. Gli unari sono la node consistency, e — trappola — l'arc consistency NON garantisce una soluzione."
495,9,1,ac3,Cos'è l'algoritmo AC-3?,un algoritmo per rendere node-consistent il grafo,un algoritmo di ricerca in ampiezza sugli stati,l'algoritmo di arc consistency (Mackworth 1977) che mantiene una coda di archi e ripristina la consistenza rimuovendo i valori senza supporto,c,flashcard_ia,"AC-3 impone l'arc consistency processando una coda di archi finché stabile. Non è una BFS sugli stati, e opera sui vincoli binari (archi), non sulla node consistency."
496,9,1,mac,Come si usa AC-3 nel backtracking (algoritmo MAC)?,"come sostituto completo del backtracking, senza ricerca","solo dopo aver trovato la soluzione, per verificarla","come preprocessing per ridurre i domini, oppure come inferenza dopo ogni assegnamento (Maintaining Arc Consistency)",c,flashcard_ia,"AC-3 si usa in preprocessing o dopo ogni assegnamento (MAC), propagando le scelte. Non sostituisce la ricerca (la potenzia) e non è una verifica finale."
497,9,1,ac3_complessita,Qual è la complessità di AC-3?,"O(n²·d³): al più n² archi, ciascuno rivisto fino a d volte con controllo O(d²)","O(d^n), esponenziale","O(n), lineare nel numero di variabili",a,flashcard_ia,AC-3: O(n²·d³) nel caso peggiore. Non è esponenziale (quello è generate-and-test d^n) né lineare: dipende da variabili e dimensione dei domini.
498,9,1,path_consistency,Cos'è la Path Consistency?,una proprietà più debole della node consistency,la consistenza dei soli vincoli unari,"una proprietà più forte dell'arc consistency: riguarda triple, inferendo vincoli impliciti su una coppia rispetto a una terza variabile",c,flashcard_ia,"Path consistency = consistenza su triple (una coppia rispetto a una terza), più forte dell'arc consistency. Non è più debole della node consistency né riguarda gli unari."
499,9,1,k_consistency,Cosa sono la k-consistency e la strong k-consistency?,k-consistency riguarda solo k=2,"k-consistent: ogni assegnamento consistente di k−1 variabili è estendibile a una k-esima; strong k-consistency = j-consistent per ogni j≤k (1=node, 2=arc, 3=path)",strong k-consistency è più debole della k-consistency,b,flashcard_ia,"k-consistency generalizza: 1=node, 2=arc, 3=path. La strong (j-consistent per ogni j≤k) è PIÙ forte, non più debole, e non è limitata a k=2."
500,9,1,alldifferent,Cos'è il vincolo Alldifferent e come si verifica?,"impone valori tutti diversi tra le variabili elencate; se n variabili hanno meno di n valori distinti disponibili, è insoddisfacibile",è un vincolo unario su una sola variabile,impone che tutte le variabili abbiano lo stesso valore,a,flashcard_ia,"Alldifferent = tutti diversi; se i valori disponibili sono meno delle variabili, impossibile (pigeonhole). Non impone valori UGUALI (l'opposto) e coinvolge più variabili (non è unario)."
501,9,1,atmost,Cos'è il vincolo Atmost?,"Atmost(N, A1..Ak) impone che le attività A1..Ak usino complessivamente al più N risorse",impone che ogni attività usi esattamente N risorse,impone che le attività siano tutte diverse,a,flashcard_ia,"Atmost = tetto sulle risorse totali (≤ N). Non è «esattamente N» per ciascuna, e «tutte diverse» è Alldifferent, un altro vincolo."
502,9,1,struttura_grafo_csp,Come si sfrutta la struttura a grafo del CSP per ridurre la complessità?,un grafo ad albero rende il CSP NP-completo,la struttura non incide mai sulla complessità,"se il grafo dei vincoli è un albero (senza cicli), il CSP si risolve in O(n·d²) senza backtracking",c,flashcard_ia,"Grafo ad albero ⇒ CSP risolvibile in tempo lineare O(n·d²), niente backtracking. Non lo rende NP-completo (anzi lo rende facile), e la struttura conta eccome."
503,9,1,cycle_cutset,Come si riduce un CSP con cicli a uno ad albero?,aggiungendo vincoli finché non spariscono i cicli,eliminando a caso metà delle variabili,"col cycle cutset: si trova un insieme di variabili la cui rimozione rende il grafo un albero, si prova ogni loro assegnamento e si risolve il resto ad albero",c,flashcard_ia,"Cycle cutset: rimuovi un piccolo insieme di variabili che spezza i cicli, prova i loro assegnamenti e risolvi il resto (albero) in tempo lineare. Non si elimina a caso né si aggiungono vincoli."
504,9,1,ricerca_locale_csp,Come funziona la ricerca locale applicata ai CSP?,assegna una variabile alla volta partendo dal vuoto,parte da un assegnamento completo (anche inconsistente) e a ogni passo cambia il valore di una variabile per ridurre i vincoli violati,esplora tutti gli assegnamenti completi in ordine,b,flashcard_ia,Ricerca locale = stato completo iniziale (magari sbagliato) e riparazioni successive per ridurre le violazioni. Assegnare dal vuoto è il backtracking; esplorare tutto è generate-and-test.
505,9,1,min_conflicts,Cos'è l'algoritmo Min-Conflicts per i CSP?,una variante del backtracking cronologico,una ricerca locale che a ogni passo prende una variabile in conflitto e le assegna il valore che minimizza i vincoli violati,un algoritmo di arc consistency,b,flashcard_ia,"Min-Conflicts: prendi una variabile in conflitto, dàlle il valore che viola meno vincoli, ripeti (ottimo su n-regine grandi). Non è backtracking né arc consistency."
506,9,1,backtracking_cronologico,Cos'è il backtracking cronologico e qual è il suo limite?,torna alla variabile responsabile del conflitto,torna sempre alla variabile assegnata immediatamente prima; limite: ignora quale variabile ha davvero causato il conflitto,non torna mai indietro,b,flashcard_ia,"Cronologico = indietro di un passo, sempre, anche se la colpa è di una variabile assegnata molto prima. Tornare alla vera responsabile è il backjumping; «mai indietro» non è backtracking."
507,9,1,backjumping,Cos'è il Backjumping?,"una variante che, in caso di fallimento, salta indietro direttamente alla variabile responsabile (usando il conflict set), non solo alla precedente",salta in avanti alle variabili non ancora assegnate,torna sempre di un passo come il cronologico,a,flashcard_ia,"Backjumping salta alla variabile del conflict set che ha causato il vicolo cieco, evitando passi inutili. Non è cronologico e non salta in avanti."
508,9,1,conflict_set,Come si definisce il conflict set di una variabile?,l'insieme di assegnamenti precedenti che rendono inconsistente ogni valore di quella variabile,l'insieme dei vicini nel grafo dei vincoli,l'insieme dei valori ancora disponibili nel dominio,a,flashcard_ia,Conflict set = gli assegnamenti passati che bruciano ogni valore della variabile. Non sono i valori residui (l'opposto) né semplicemente i vicini del grafo.
509,9,1,conflict_set_minimo,Cos'è il conflict set minimo?,il conflict set con il maggior numero di assegnamenti,l'insieme vuoto,"un conflict set da cui, togliendo un qualsiasi assegnamento, non resta più un conflict set",c,flashcard_ia,"Minimo = irriducibile: ogni elemento è necessario a causare il conflitto (es. {Q=R,NSW=G,V=B} per SA in Australia). Non è il più grande né vuoto."
510,9,1,nogood,Cos'è un assegnamento NOGOOD?,un assegnamento parziale che non può essere esteso a nessuna soluzione,un assegnamento completo e consistente,il miglior assegnamento trovato finora,a,flashcard_ia,"NOGOOD = un parziale senza futuro (nessuna soluzione lo estende), analogo agli «stati insicuri». Non è una soluzione (l'opposto) né il migliore corrente."
511,9,1,conflict_directed_backjumping,Come si aggiorna il conflict set nel conflict-directed backjumping?,si copia l'intero dominio di Xj in Xi,si azzera il conflict set di Xi,"quando Xj fallisce e si salta a Xi, si fa conf(Xi) ← conf(Xi) ∪ conf(Xj) − {Xi}, propagando la causa del conflitto",c,flashcard_ia,CBJ propaga la responsabilità: il conflict set di Xi assorbe quello di Xj (meno Xi). Non lo si azzera (si perderebbe l'informazione) né si copiano domini.
512,9,1,fc_backjumping,Qual è la relazione tra forward checking e backjumping?,il forward checking impedisce ogni forma di backjumping,sono la stessa identica tecnica,"il FC può essere esteso per costruire i conflict set: registrando quale variabile ha cancellato quali valori, fornisce l'informazione per il backjump",c,flashcard_ia,"FC sa chi ha svuotato quali domini, quindi può alimentare i conflict set del backjumping. Non sono la stessa tecnica, e FC non impedisce il backjump: lo abilita."
513,9,1,confronto_csp,Confronto degli approcci CSP dal meno al più efficace: quale ordine è corretto?,backtracking semplice < generate-and-test < ricerca locale,"generate-and-test (d^n) < backtracking semplice < backtracking + euristiche/inferenza (MRV, FC, AC-3)",sono tutti equivalenti in efficienza,b,flashcard_ia,"Si sale in efficacia: forza bruta (d^n), poi backtracking, poi backtracking potenziato da euristiche e propagazione. Generate-and-test è il PEGGIORE, non intermedio, e non sono equivalenti."
514,9,1,miglioramenti_backtracking,In quali categorie si classificano i miglioramenti al backtracking semplice?,"quale variabile/valore scegliere (euristiche MRV, degree, LCV), inferenza durante la ricerca (FC, AC-3) e come tornare indietro (backjumping)",solo la scelta del linguaggio di programmazione,solo l'aumento della memoria disponibile,a,flashcard_ia,"Tre leve: ordinamento di variabili/valori (euristiche), propagazione (FC/AC-3), backtracking intelligente (backjumping). Linguaggio e memoria non sono miglioramenti algoritmici."
515,9,2,knowledge_base,Cos'è una Knowledge Base (KB)?,"un insieme di formule in un linguaggio di rappresentazione, che contiene ciò che l'agente sa e su cui ragiona",un database relazionale di tabelle e righe,l'insieme dei sensori dell'agente,a,flashcard_ia,"KB = formule in un linguaggio di rappresentazione, la testa dell'agente. Non è un database SQL né l'hardware sensoriale: confonderli è da chi non ha aperto il libro."
516,9,2,background_knowledge,Cos'è il background knowledge di un agente KB?,il colore di sfondo dell'interfaccia,ciò che l'agente impara solo dopo aver agito,la conoscenza iniziale dell'agente prima di interagire con l'ambiente (es. precondizioni ed effetti delle azioni),c,flashcard_ia,"Background = ciò che l'agente sa GIÀ prima di partire (le azioni disponibili). Non è ciò che impara dopo (sarebbe apprendimento), e ovviamente non è grafica."
517,9,2,tell_ask,Quali sono i due meccanismi con cui un agente interagisce con la KB?,"Tell (assert), che aggiunge una formula, e Ask (query), che interroga per inferenza","Insert e Delete, come in un database",Compile e Run,a,flashcard_ia,"Tell aggiunge conoscenza, Ask la interroga derivando per inferenza. Non sono Insert/Delete di SQL né compile/run: è ragionamento, non gestione dati."
518,9,2,kb_agent_schema,Cosa fa a ogni ciclo lo schema KB-Agent?,esplora l'albero di ricerca con una coda FIFO,"Tell della percezione, Ask per l'azione, Tell dell'azione eseguita, poi avanza il tempo",addestra una rete neurale sui dati percepiti,b,flashcard_ia,"KB-Agent: racconta alla KB cosa percepisce (Tell), le chiede cosa fare (Ask), le dice cosa ha fatto (Tell), incrementa il tempo. Non è ricerca cieca né training di reti."
519,9,2,dato_info_conoscenza,"Qual è la differenza tra dato, informazione e conoscenza?",dato = conoscenza certa; conoscenza = dato incerto,sono tre sinonimi,dato = simbolo grezzo senza contesto; informazione = dato interpretato in un contesto; conoscenza = informazione organizzata e usabile per ragionare,c,flashcard_ia,"Scala: dato (grezzo) → informazione (contestualizzato) → conoscenza (organizzata, azionabile). Non sono sinonimi, e la gerarchia non è quella capovolta del distrattore."
520,9,2,dichiarativo_procedurale,Qual è la differenza tra programmazione dichiarativa e procedurale?,"sono identiche, solo sintassi diversa",la dichiarativa è sempre più veloce,"dichiarativa: specifichi COSA è vero (fatti e regole), separando conoscenza e ragionamento; procedurale: specifichi COME, i passi da eseguire",c,flashcard_ia,"Dichiarativa = il COSA (conoscenza separata dal motore); procedurale = il COME (i passi). Non sono la stessa cosa con sintassi diversa, e la velocità non è il punto."
521,9,2,kb_componenti_blocchi,Quali sono i tre componenti di un agente KB nel mondo dei blocchi?,"background knowledge (azioni con precondizioni/effetti), percezione (stato corrente) e metodo (criterio generale per scegliere l'azione)","compilatore, linker e runtime","sensori, attuatori e batteria",a,flashcard_ia,"I tre pezzi: cosa sa (background), cosa vede (percezione), come decide (metodo generale). Non è una toolchain né l'hardware fisico dell'agente."
522,9,2,pick_azione,"Nel mondo dei blocchi, quali sono precondizioni ed effetti di pick(x,y)?","precondizioni: on(x,y) ∧ clear(x) ∧ handempty; effetti: si solleva x, y diventa clear e la mano non è più vuota",precondizione: la mano è già occupata,"nessuna precondizione, si può sempre eseguire",a,flashcard_ia,"pick(x,y) richiede x su y, x libero e mano vuota; poi solleva x liberando y. Non è eseguibile «sempre» (le precondizioni servono a questo) e la mano dev'essere VUOTA per prendere."
523,9,2,linguaggio_rappresentazione,Cos'è un linguaggio di rappresentazione in logica?,un formato di file per salvare immagini,lo strumento per esprimere la conoscenza in una forma su cui applicare ragionamento automatico; una formula che ne segue le regole è «ben formata»,un linguaggio di programmazione imperativo,b,flashcard_ia,Il linguaggio di rappresentazione codifica la conoscenza per il ragionamento automatico (formule ben formate). Non è C++ né un formato immagine: siamo in logica.
524,9,2,modello_logica,Cos'è un modello in logica?,l'insieme delle regole di inferenza,una rete neurale addestrata,un mondo possibile che fissa i valori di verità delle formule; M(α) è l'insieme dei modelli in cui α è vera,c,flashcard_ia,Modello = un'assegnazione di verità (un mondo possibile). M(α) raccoglie i mondi dove α è vera. Non è una rete neurale né le regole di inferenza.
525,9,2,sintassi_proposizionale,Quali sono i connettivi della logica proposizionale?,"solo AND e OR, niente negazione",i quantificatori ∀ e ∃,"¬ (NOT), ∧ (AND), ∨ (OR), → (implicazione), ↔ (bicondizionale), più le costanti True/False",c,flashcard_ia,"Connettivi proposizionali: ¬, ∧, ∨, →, ↔. La negazione c'è eccome; ∀ ed ∃ sono della logica del PRIM'ORDINE, non della proposizionale: non anticipare i quantificatori."
526,9,2,entailment,Cos'è la conseguenza logica (entailment) A ⊨ B?,A e B sono vere negli stessi identici modelli,"in tutti i modelli in cui A è vera, anche B è vera; insiemisticamente M(A) ⊆ M(B)",B implica sintatticamente A,b,flashcard_ia,"A ⊨ B: ovunque A è vera lo è pure B (M(A) ⊆ M(B)). «Stessi modelli» è l'EQUIVALENZA (più forte); e la direzione è A→B, non il contrario."
527,9,2,direzionalita_entailment,Cosa significa A ⊭ B?,B non è mai vera,esiste almeno un modello in cui A è vera ma B è falsa; conta solo dove A è vera,A e B sono equivalenti,b,flashcard_ia,"A ⊭ B: basta un controesempio (A vera, B falsa) per far cadere la conseguenza. Non significa che B non sia mai vera né che siano equivalenti: conta solo dove A è vera."
528,9,2,equivalenza_logica,Cos'è l'equivalenza logica A ≡ B?,A e B hanno lo stesso numero di simboli,"A ⊨ B e B ⊨ A: vere esattamente negli stessi modelli, M(A) = M(B)","A ⊨ B, senza bisogno del viceversa",b,flashcard_ia,"Equivalenza = doppia conseguenza (M(A)=M(B)). Non c'entra il numero di simboli, e servono ENTRAMBE le direzioni: la sola A ⊨ B è conseguenza, non equivalenza."
529,9,2,validita,Cosa significa che una formula è VALIDA (tautologia)?,"è vera in tutti i modelli (P ≡ True), es. Q ∨ ¬Q",è falsa in tutti i modelli,è vera in almeno un modello,a,flashcard_ia,"Valida = vera SEMPRE (tautologia, es. terzo escluso). Vera in almeno un modello è la SODDISFACIBILITÀ; falsa ovunque è la contraddizione. Non confonderle."
530,9,2,insoddisfacibilita,Cosa significa che una formula è INSODDISFACIBILE (contraddizione)?,è vera in tutti i modelli,"è falsa in tutti i modelli (P ≡ False), es. Q ∧ ¬Q; e P è valida se e solo se ¬P è insoddisfacibile",è vera in almeno un modello,b,flashcard_ia,Insoddisfacibile = falsa ovunque (contraddizione). Vera ovunque è la validità (e infatti P valida ⇔ ¬P insoddisfacibile); vera in almeno uno è soddisfacibile.
531,9,2,soddisfacibilita,Cosa significa che una formula è SODDISFACIBILE?,è vera in tutti i modelli,è falsa in tutti i modelli,esiste almeno un modello in cui è vera,c,flashcard_ia,Soddisfacibile = c'è almeno un mondo che la rende vera. Vera in TUTTI è validità; falsa ovunque è contraddizione. Nei CSP cercare una soluzione = cercare un modello.
532,9,2,inferenza_def,Cos'è l'inferenza?,l'assegnazione di valori di verità ai simboli,"il processo sintattico con cui da proposizioni accolte come vere se ne deriva un'altra, lavorando sulla struttura delle formule",la misura della distanza dal goal,b,flashcard_ia,Inferenza = derivare conclusioni operando sulla SINTASSI (struttura) delle formule. Assegnare verità è la semantica (i modelli); la distanza dal goal è l'euristica di ricerca.
533,9,2,sintattico_semantico,Qual è la differenza tra ⊢ (inferenza sintattica) e ⊨ (conseguenza semantica)?,"⊢ guarda i modelli, ⊨ usa le regole","⊨ guarda i modelli (α vera ovunque KB è vera); ⊢ deriva α con regole di inferenza, senza guardare i modelli",sono la stessa relazione con due simboli diversi,b,flashcard_ia,"⊨ = semantica (modelli); ⊢ = sintassi (regole di derivazione). Non sono la stessa cosa, e i ruoli sono invertiti nel distrattore: attenzione a quale simbolo è quale."
534,9,2,soundness_completeness,Cosa sono correttezza (soundness) e completezza di un sistema di inferenza?,sound: se KB ⊢ α allora KB ⊨ α (derivi solo il vero); completo: se KB ⊨ α allora KB ⊢ α (derivi tutto il vero),sono sinonimi,sound: derivi tutto; completo: derivi solo il vero,a,flashcard_ia,Sound = non spari cavolate (⊢ ⇒ ⊨); completo = non ti sfugge niente (⊨ ⇒ ⊢). Nel distrattore sono scambiati: è la trappola d'esame per eccellenza. Non sono sinonimi.
535,9,2,modus_ponens,Enuncia il Modus Ponens.,da A → B e A si deriva B,da A → B e ¬B si deriva A,da A ∨ B e ¬A si deriva ¬B,a,flashcard_ia,"Modus ponens: hai la regola A→B e il fatto A, concludi B. «A→B e ¬B ⇒ ¬A» è il modus TOLLENS (diverso); l'ultima è pure sbagliata. È un caso speciale di risoluzione."
536,9,2,and_elimination,Enuncia la regola di And-Elimination.,da A ∧ B si può derivare un qualsiasi congiunto (A oppure B),da A ∨ B si deriva A ∧ B,da A si deriva A ∧ B,a,flashcard_ia,"And-elimination: se vale A∧B, allora vale A (e vale B). Da un OR non ricavi l'AND, e da A soltanto non inventi A∧B: quella sarebbe magia, non logica."
537,9,2,equivalenze_fondamentali,Quale delle seguenti è un'equivalenza logica corretta?,¬(α ∧ β) ≡ (¬α ∧ ¬β),la contrapposizione: (α → β) ≡ (¬β → ¬α),(α → β) ≡ (β → α),b,flashcard_ia,"Contrapposizione: α→β ≡ ¬β→¬α, corretta. Invertire l'implicazione (β→α) è un errore classico; e De Morgan dà ¬(α∧β) ≡ ¬α∨¬β (OR, non AND)."
538,9,2,teorema_deduzione,Cosa afferma il teorema di deduzione?,R ⊨ Q se e solo se (R ∧ Q) è soddisfacibile,R ⊨ Q se e solo se (R → Q) è valida (tautologia),R ⊨ Q se e solo se R è insoddisfacibile,b,flashcard_ia,"Teorema di deduzione: la conseguenza R⊨Q equivale alla validità di R→Q. La congiunzione soddisfacibile non c'entra, e l'insoddisfacibilità di R non dice nulla su Q."
539,9,2,refutazione,Cos'è la dimostrazione per refutazione?,R ⊨ Q se e solo se (R ∧ ¬Q) è soddisfacibile,si dimostra Q assumendola già vera,R ⊨ Q se e solo se (R ∧ ¬Q) è insoddisfacibile: si nega la tesi e si cerca una contraddizione (la clausola vuota),c,flashcard_ia,"Refutazione: aggiungi ¬Q alla KB e cerca l'assurdo (clausola vuota). Assumere Q vera sarebbe circolare; e serve INSODDISFACIBILITÀ, non soddisfacibilità (segno invertito = errore)."
540,9,2,logiche_monotone,Cosa sono le logiche monotone?,aggiungere conoscenza può cancellare conclusioni precedenti,aggiungere conoscenza non invalida ciò che era già derivato: se KB ⊨ P allora KB ∧ Q ⊨ P (la proposizionale è monotona),le formule hanno un solo valore di verità,b,flashcard_ia,"Monotona = la nuova conoscenza non ritratta le vecchie conclusioni. Il caso in cui aggiungere info CANCELLA conclusioni è la logica NON monotona (default reasoning), l'opposto."
541,9,2,model_checking,Come funziona il model checking (TT-Entails) per KB ⊨ α?,deriva α con le regole di inferenza senza guardare i modelli,enumera tutti i modelli e verifica che in ogni modello dove KB è vera lo sia anche α; costa O(2^n) con n simboli,campiona casualmente pochi modelli,b,flashcard_ia,"TT-Entails = forza bruta semantica: prova tutti i 2^n assegnamenti. Derivare con le regole è l'approccio SINTATTICO (⊢); e non campiona a caso, li enumera tutti (per questo è esponenziale)."
542,9,2,cnf,Cos'è la Forma Normale Congiuntiva (CNF)?,una singola implicazione,"una congiunzione di clausole, dove ogni clausola è una disgiunzione di letterali (AND di OR)",una disgiunzione di congiunzioni (OR di AND),b,flashcard_ia,"CNF = AND di OR (congiunzione di clausole). L'OR di AND è la DNF (forma DISgiuntiva), il suo opposto. Ogni formula ammette una CNF equivalente."
543,9,2,cnf_esempi,Quale di queste formule è in CNF?,¬(B ∨ C),(A ∨ B) ∧ (¬B ∨ C ∨ ¬D),(A ∧ B) ∨ C,b,flashcard_ia,"In CNF: AND di clausole OR, come (A∨B)∧(¬B∨C∨¬D). «(A∧B)∨C» ha un OR fuori da un AND; «¬(B∨C)» ha la negazione non spinta sui letterali: entrambe NON sono in CNF."
544,9,2,conversione_cnf,Quali sono i passi per convertire una formula in CNF?,"eliminare ↔, poi eliminare →, poi spingere il ¬ sui letterali (De Morgan + doppia negazione), infine distribuire ∨ su ∧",eliminare i simboli proposizionali,"distribuire subito ∧ su ∨, senza toccare le implicazioni",a,flashcard_ia,"Ordine: via ↔, via →, ¬ spinto dentro (De Morgan), distribuzione ∨/∧. Distribuire nel verso sbagliato o «eliminare i simboli» non ha senso: i simboli sono il contenuto."
545,9,2,conversione_cnf_esempio,"Convertendo in CNF, (A ∧ B) ∨ C diventa:",A ∧ B ∧ C,"resta (A ∧ B) ∨ C, è già in CNF","(A ∨ C) ∧ (B ∨ C), distribuendo ∨ su ∧",c,flashcard_ia,"Distribuendo l'∨ sull'∧: (A∨C)∧(B∨C). Non diventa la congiunzione secca A∧B∧C, e NON è già in CNF (ha un OR sopra un AND): è proprio questo il punto della conversione."
546,9,2,risoluzione_regola,Enuncia la regola di risoluzione.,"da A → B e A si deriva B, senza clausole",da A ∧ B si deriva A,da due clausole con letterali complementari (P e ¬P) si deriva il resolvent: l'unione dei letterali restanti,c,flashcard_ia,"Risoluzione: due clausole con una coppia complementare (P, ¬P) → resolvent = tutti gli altri letterali uniti. And-elimination e modus ponens sono regole diverse (il MP ne è un caso particolare)."
