id,cfu,parte,topic,question,opt_a,opt_b,opt_c,correct,source,explanation
263,9,1,quadrante_comportamento_umano,Il quadrante «comportamento umano / approccio forte» è rappresentato da:,la progettazione di agenti razionali,il Test di Turing (1950),la modellazione cognitiva,b,flashcard_ia,"«Sembra umano visto da fuori» = Test di Turing, e basta. La modellazione cognitiva guarda DENTRO, al pensiero: se le confondi, non hai capito neppure gli assi."
264,9,1,quadrante_pensiero_razionale,Il quadrante «pensiero razionale / approccio debole» è esemplificato da:,il Test di Turing,un robot con sonar che schiva ostacoli,l'inferenza logica (codifica formale del ragionamento),c,flashcard_ia,"Leggi del pensiero corretto = inferenza logica. Il robot col sonar è comportamento, Turing è umano. Qui contano i ragionamenti giusti, non le imitazioni."
265,9,1,quadrante_comportamento_razionale,Il quadrante «comportamento razionale / approccio debole» corrisponde a:,riprodurre i meccanismi interni della mente umana,superare il Test di Turing imitando l'uomo,agire «facendo la cosa giusta» senza necessariamente usare meccanismi umani (es. robot con sonar),c,flashcard_ia,"Fare la cosa giusta, anche in modo per niente umano: il robot col sonar. È l'approccio «agente razionale» del corso. Chi lo scambia per «mente umana» ha proprio sbagliato quadrante."
266,9,1,quando_ia_serve,In quale caso l'IA NON è l'approccio adatto?,quando il problema è non deterministico e con molte soluzioni,quando esistono modelli matematici precisi e metodi algoritmici specifici per il problema,"quando la conoscenza è ampia, incompleta e di natura simbolica",b,flashcard_ia,"Se esiste una formula esatta o un algoritmo preciso usi quello, e l'IA la lasci in pace. L'IA serve quando è tutto sfumato: non determinismo, tante soluzioni, preferenze, dati simbolici, conoscenza incompleta. Rispondere il contrario è non aver capito a cosa serve la materia."
267,9,1,discipline_fondamento,Quale delle seguenti NON è una disciplina di fondamento dell'IA?,la linguistica,le neuroscienze,la termodinamica,c,flashcard_ia,"Filosofia, matematica, economia, neuroscienze, psicologia, informatica, controllo/cibernetica, linguistica. La termodinamica non c'è: è l'intrusa, piazzata lì per chi tira a indovinare."
268,9,1,aristotele_deliberazione,Quale contributo diede Aristotele (Etica Nicomachea) all'IA?,il primo calcolatore meccanico programmabile,la nozione di rete neurale artificiale,il primo esempio di algoritmo di deliberazione: si delibera sui mezzi (non sui fini) per raggiungere un obiettivo dato,c,flashcard_ia,"Aristotele: si delibera sui MEZZI, non sui fini. Primo algoritmo di deliberazione della storia. Chi ci vede calcolatori o reti neurali sbaglia di un paio di millenni."
269,9,1,psicologia_pavlov,Quale contributo diede la psicologia alle origini dell'IA?,la logica del primo ordine,modelli scientifici del comportamento e dell'apprendimento (es. il riflesso condizionato di Pavlov),l'architettura di von Neumann,b,flashcard_ia,"La psicologia dà modelli di come si pensa e si impara: Pavlov e il riflesso condizionato. La logica è di matematica/filosofia, i calcolatori dell'informatica. Attribuire tutto a una disciplina sola è pigrizia."
270,9,1,imperativo_vs_dichiarativo,Qual è la differenza tra approccio tradizionale (imperativo) e approccio dichiarativo (IA)?,il dichiarativo è più veloce perché viene compilato,"l'imperativo non usa variabili, il dichiarativo sì",l'imperativo specifica il COME (sequenza di passi per un singolo compito); il dichiarativo specifica il COSA (la conoscenza) e lascia al sistema derivare la soluzione,c,flashcard_ia,"Imperativo = scrivi tu il COME, passo per passo. Dichiarativo (l'IA) = descrivi il COSA e il sistema trova la strada. «È più veloce perché compilato» è una sciocchezza: non è quello il punto."
271,9,1,sistema_dichiarativo_componenti,Da quali componenti principali è strutturato un sistema IA ad approccio dichiarativo?,"sensori, attuatori e alimentazione elettrica","knowledge base, modulo deliberativo (ragionamento) e componente di azione/esecuzione","compilatore, linker e runtime",b,flashcard_ia,"Knowledge base, modulo deliberativo, esecuzione dell'azione. Chi risponde «compilatore, linker, runtime» ha scambiato un agente intelligente per un progetto di Programmazione 1."
272,9,1,programma_costruisce_programma,Cosa significa che il sistema IA è «un programma che costruisce un programma»?,riscrive il proprio codice sorgente a runtime,compila sé stesso in linguaggio macchina,"dato lo stato iniziale e il goal, elabora la conoscenza delle azioni per generare autonomamente la sequenza di passi (il piano)",c,flashcard_ia,"Il «programma» costruito è il PIANO: la sequenza di azioni dal via al goal. Non è auto-compilazione né codice che si riscrive da solo: quella è fantascienza, non questo corso."
273,9,1,agente_razionale,Cos'è un agente razionale?,un agente che imita sempre il comportamento umano,un agente che massimizza la prestazione già osservata in passato,"un agente che sceglie l'azione che massimizza la misura di prestazione attesa, data la sequenza percettiva e la conoscenza dell'ambiente",c,flashcard_ia,Razionale = massimizza la prestazione ATTESA date percezioni e conoscenza. Non «imita l'uomo» e non guarda al passato già visto. Chi confonde razionale con umano non ha capito la definizione cardine della materia.
274,9,1,funzione_deliberativa,Cos'è la funzione deliberativa di un agente?,la funzione che traduce i pixel in simboli,la funzione che libera la memoria dell'agente,"la funzione che determina quali azioni eseguire per «fare la cosa giusta», guidata da una misura di prestazione",c,flashcard_ia,"Decide quali azioni eseguire per «fare la cosa giusta», guidata da una misura di prestazione. Non pulisce la memoria e non percepisce: quelle sono altre componenti. Serve precisione, non intuito."
275,9,1,automazione_vs_autonomia,Cosa distingue automazione e autonomia?,l'automazione richiede più sensori dell'autonomia,sono sinonimi,nell'automazione si programma ogni passo (domini ripetitivi); nell'autonomia l'agente riceve compiti ad alto livello e decide da sé come eseguirli,c,flashcard_ia,Automazione = gli programmi ogni passo (saldatura industriale). Autonomia = gli dai l'obiettivo e si arrangia. «Sono sinonimi» è la risposta di chi le slide non le ha aperte.
276,9,1,agente_autonomo_caratteristiche,Quale NON è una caratteristica di un agente autonomo?,riceve compiti ad alto livello e ragiona sulle alternative,riconosce quando non può proseguire,esegue una sequenza fissa di passi pre-programmati per ogni compito,c,flashcard_ia,"Sequenza fissa pre-programmata = automazione, quindi è l'intrusa. L'autonomo riceve obiettivi ad alto livello, esplora alternative, riconosce i fallimenti: le tre vere caratteristiche vanno sapute."
277,9,1,autonomia_mito_realta,"Qual è la realtà tecnica dell'autonomia, contro la visione popolare?",un agente autonomo è per definizione self-conscious,"è la capacità tecnica di scegliere azioni entro i compiti assegnati, non una coscienza «extra-programma» incontrollabile",l'autonomia emerge spontaneamente e non è governabile,b,flashcard_ia,"Tecnicamente autonomia = scegliere azioni entro i compiti dati. La macchina cosciente e ribelle sta nei film, non all'esame. Chi risponde «self-conscious» ha studiato su Netflix."
278,9,1,gradi_di_autonomia,"Cosa mostrano metropolitana automatica, rover su Marte e auto senza guidatore riguardo all'autonomia?",che compiti simili in ambienti diversi richiedono gradi di autonomia crescenti con la complessità dell'ambiente,che tutti gli agenti autonomi hanno lo stesso grado di autonomia,che l'autonomia dipende solo dalla potenza di calcolo,a,flashcard_ia,"Stesso compito (vai da A a B), ambienti diversi: rotaia, piana marziana, traffico. Più l'ambiente è complesso, più autonomia serve. Non è la potenza di calcolo a decidere: è l'ambiente."
279,9,1,peas_metropolitana,"Nel PEAS della metropolitana automatica, quali sono le azioni principali?",accelerare e decelerare lungo la rotaia,pianificare rotte alternative in tempo reale,sterzare ed evitare i pedoni,a,flashcard_ia,"Rotaia, partenza e arrivo fissi: si accelera e si frena, fine. Sterzo e pedoni sono dell'auto. Chi «pianifica rotte alternative» su un binario me lo venga a spiegare."
280,9,1,peas_rover,"Nel PEAS del rover su Marte, come si caratterizza l'ambiente?",una rotaia con partenza e arrivo fissi,"una piana con qualche roccia, semplice: nessun altro agente e fenomeni atmosferici trascurabili",una strada affollata di veicoli e pedoni,b,flashcard_ia,"Piana marziana con qualche sasso, nessun altro agente, niente meteo drammatico: ambiente semplice ma libero (accelera, frena, gira). Non è il traffico e non è una rotaia: il PEAS si legge prima di rispondere."
281,9,1,peas_auto,"Nel PEAS dell'auto senza guidatore, cosa rende l'ambiente complesso?",il fatto di muoversi su una rotaia,"molti agenti imprevedibili (auto, pedoni, animali) e condizioni variabili (pioggia, giorno/notte)",l'assenza totale di sensori,b,flashcard_ia,"Traffico, pedoni, animali, pioggia, buio: agenti imprevedibili, ambiente dinamico. Per questo richiede più autonomia dei tre. «Nessun sensore» o «su rotaia»? Nemmeno per scherzo."
282,9,1,percepire_vs_dati,Qual è la distinzione tra «vedere» (percepire) e «incamerare dati» per una telecamera?,sono la stessa cosa: i pixel sono già percezione,la telecamera cattura pixel (codifiche numeriche); «vedere» richiede interpretare quei dati collegandoli a un significato,«vedere» significa semplicemente catturare più pixel possibile,b,flashcard_ia,"La telecamera prende pixel, cioè numeri. «Vedere» è dargli un senso e collegarli al mondo (grounding). «Sono la stessa cosa» è esattamente l'errore che la domanda vuole smascherare."
283,9,1,sfide_percezione,Quale NON è tra le difficoltà nell'identificare un passaggio pedonale da un'immagine?,la prospettiva e l'angolo di ripresa,la velocità di clock della CPU dell'agente,il colore delle strisce e la qualità dell'immagine,b,flashcard_ia,"Prospettiva, colore, qualità, contesto, mille rappresentazioni: difficoltà VISIVE. La velocità della CPU non c'entra niente: è l'intrusa, e chi la sceglie il problema della percezione non l'ha capito."
284,9,1,grounding,Cos'è il «grounding» in IA?,l'addestramento su grandi corpus testuali,la messa a terra elettrica dell'hardware,il legame tra la rappresentazione simbolica/formale e l'ambiente reale che essa rappresenta,c,flashcard_ia,"Grounding = legame tra simbolo e pezzo di mondo che rappresenta, tramite la percezione. Non è la messa a terra elettrica (non siamo a Impianti) né il training su testi."
285,9,1,grounding_esempio_regina,Come illustra il grounding l'esempio «la regina difende il re»?,la frase è ambigua e solo il grounding sceglie la realtà di riferimento corretta (persone reali vs pezzi degli scacchi),dimostra che il linguaggio non è mai ambiguo,mostra che gli scacchi sono l'unico dominio di riferimento possibile,a,flashcard_ia,«La regina difende il re»: persone o pezzi degli scacchi? Decide il grounding. Chi risponde «il linguaggio non è mai ambiguo» evidentemente l'italiano non lo parla.
286,9,1,modelli_logica,Cosa sono i «modelli» in logica e che rapporto hanno col grounding?,assegnamenti di valori che rendono calcolabile il valore di verità di una formula; realtà diverse (grounding diverso) danno modelli diversi,reti neurali addestrate a valutare la formula,esempi di codice che implementano la formula,a,flashcard_ia,"Modello = assegnamento di verità che valuta la formula. Cambi il mondo (grounding) e cambiano i modelli: stessa frase, vera qui e falsa là. Non sono reti neurali né codice."
287,9,1,inferenza_vs_conseguenza,Qual è la differenza tra inferenza e conseguenza logica?,l'inferenza è una conclusione tratta dalle premesse ma non necessariamente sempre vera; la conseguenza logica è vera in OGNI caso in cui le premesse lo sono,"la conseguenza logica ammette eccezioni, l'inferenza no",sono sinonimi,a,flashcard_ia,"Conseguenza logica = zero eccezioni: premesse vere ⇒ conclusione necessariamente vera. L'inferenza in senso lato può non reggere sempre. Chi dice «la conseguenza ammette eccezioni» ha invertito tutto, e all'esame lo pago caro."
288,9,1,mondo_dei_blocchi,Cos'è il «mondo dei blocchi» come toy problem?,un problema giocattolo in cui un agente sposta blocchi da una configurazione iniziale a una configurazione goal,un modello di rete neurale convoluzionale,un algoritmo di ordinamento di array,a,flashcard_ia,Toy problem: sposti blocchi da una configurazione all'altra per studiare pianificazione e ricerca. Non è un algoritmo di ordinamento né una CNN: confonderli è preoccupante.
289,9,1,azione_precondizioni_effetti,Cosa bisogna conoscere per ogni azione nel mondo dei blocchi?,le precondizioni (quando è applicabile) e gli effetti (come cambia lo stato),il tempo di esecuzione in millisecondi,il colore dei blocchi coinvolti,a,flashcard_ia,Di ogni azione servono precondizioni (quando si può) ed effetti (cosa cambia). Millisecondi e colori dei blocchi non sono conoscenza: sono rumore messo lì apposta.
290,9,1,soluzione_ottima_blocchi,Cos'è una soluzione nel mondo dei blocchi e come si sceglie tra più soluzioni?,una sequenza di azioni dallo stato iniziale al goal; tra le alternative si sceglie in base a un criterio (soluzione ottima),"l'unico percorso possibile, che è sempre unico",un qualunque stato che assomigli al goal,a,flashcard_ia,"Soluzione = sequenza di azioni fino al goal; ce n'è più d'una, quindi serve un criterio (il costo) per l'ottima. «Percorso unico» o «stato somigliante»? No: la definizione si legge."
291,9,1,toy_vs_real_problem,Cosa distingue un toy problem da un real-world problem?,il toy problem richiede più calcolo del real-world,il real-world è sempre deterministico,"il toy problem è semplificato, controllato e completamente descrivibile; il real-world è complesso e parzialmente osservabile/prevedibile",c,flashcard_ia,"Toy = miniatura pulita e tutta descrivibile. Real-world = complesso, parzialmente osservabile, imprevedibile. E no, il mondo reale NON è deterministico: se l'hai pensato, ripassa gli ambienti."
292,9,1,approcci_problem_solving,Quali sono le tre principali categorie di approcci alla risoluzione automatica di problemi?,"ordinamento, ricerca binaria e hashing","ricerca nello spazio degli stati, ricerca con avversario (giochi), soddisfacimento di vincoli (CSP)","regressione, classificazione e clustering",b,flashcard_ia,"Tre approcci: spazio degli stati, giochi (con avversario, informazione completa), CSP. Ordinamento/hashing e regressione/clustering sono di altri corsi. Questa è la struttura del programma: saperla è il minimo."
293,9,1,studio_problem_solving,Cosa si studia nella risoluzione automatica di problemi?,come addestrare reti neurali profonde,come progettare circuiti digitali,"come definire problema e soluzione, come distinguere soluzione da soluzione ottima e quali approcci algoritmici usare",c,flashcard_ia,"Si studia cos'è un problema, cos'è una soluzione, quando è ottima, quali algoritmi usare. Circuiti e deep learning non c'entrano: quella è un'altra materia."
294,9,1,pavlov_condizionamento,Come si forma il riflesso condizionato di Pavlov?,programmando esplicitamente la risposta desiderata,"associando ripetutamente uno stimolo neutro (campana) a uno incondizionato (cibo), finché lo stimolo neutro da solo provoca la risposta (salivazione)",punendo l'animale finché smette il comportamento,b,flashcard_ia,Cibo → salivazione; campana da sola → niente; campana + cibo ripetuti → basta la campana. Apprendimento per associazione. Punizioni o codice a mano sono risposte di chi Pavlov non l'ha letto.
295,9,1,psicologia_rilevanza_ia,Perché la psicologia è rilevante come disciplina di fondamento dell'IA?,definisce la sintassi dei linguaggi di programmazione,"fornisce modelli di come uomini e animali pensano e apprendono (comportamento, apprendimento)",fornisce i teoremi di complessità computazionale,b,flashcard_ia,La psicologia dà modelli di come si pensa e si impara: utile per agenti che apprendono. Sintassi dei linguaggi e complessità computazionale vengono da informatica e matematica. Non si mescolano le discipline a caso.
296,9,1,filosofia_aristotele_backward,Cosa contribuì la filosofia (Aristotele) alla nascita dell'IA?,il primo linguaggio di programmazione,il processo di deliberazione razionale: dal fine si ragiona a ritroso sui mezzi per raggiungerlo (backward reasoning),la struttura del perceptron,b,flashcard_ia,"Aristotele parte dal fine e torna indietro ai mezzi: ragionamento all'indietro, antenato della pianificazione. Non ha inventato linguaggi né perceptron, quelli sono arrivati un filo dopo."
297,9,1,agent_loop,Qual è la struttura generale dell'«agent loop»?,"compila, linka ed esegui una sola volta","addestra, valida e testa il modello","leggi i sensori, applica la funzione di controllo/deliberazione a letture e conoscenza, esegui l'azione, e ripeti",c,flashcard_ia,"Leggi sensori → decidi azione (percezioni + conoscenza) → esegui → ripeti. È il ciclo dell'agente, non «compila-linka-esegui» e nemmeno «addestra-valida-testa». Confonderlo col ML è da matita rossa."
298,9,1,domande_fondamentali_agente,"Di fronte a un problema reale (es. attraversare la strada), a quali domande fondamentali deve rispondere un agente?",quale linguaggio di programmazione utilizzare,"cosa percepire, come agire e quando agire nell'ambiente",quanta memoria RAM allocare,b,flashcard_ia,"Tre domande: COSA percepire, COME agire, QUANDO agire. Scelte di percezione e azione. «Quale linguaggio» o «quanta RAM» sono dettagli implementativi: fuori tema, fuori punteggio."
299,9,1,stato_definizione,Cos'è uno STATO nella risoluzione automatica di problemi?,il costo accumulato lungo il cammino,un'astrazione della realtà che cattura solo le informazioni rilevanti per risolvere il problema,l'insieme di tutte le azioni eseguibili dall'agente,b,flashcard_ia,Uno stato astrae la realtà tenendo solo ciò che serve: il mondo diventa un insieme discreto di stati con transizioni. Confonderlo con le azioni o col costo vuol dire non aver capito il modello stati-azioni.
300,9,1,modello_stati_azioni,Quali caratteristiche ha il modello stati-azioni usato nella ricerca?,"stati discreti, effetto deterministico delle azioni e stato osservabile",stati continui e azioni stocastiche,assenza di stato iniziale e di test obiettivo,a,flashcard_ia,"Il modello base discretizza la realtà, assume azioni deterministiche e stato conoscibile. Chi risponde «continui e stocastici» sta descrivendo un altro mondo, non la ricerca classica."
301,9,1,effetto_non_deterministico,Quando un'azione ha effetto NON deterministico?,quando l'azione non ha precondizioni,quando l'azione ha costo variabile,"quando la stessa azione nello stesso stato può portare a stati diversi, per informazioni non rappresentate nello stato",c,flashcard_ia,"Non determinismo = stesso stato, stessa azione, esiti diversi, perché lo stato non cattura tutto. Non c'entrano precondizioni o costo: sono altri parametri."
302,9,1,obiettivo_definizione,Cos'è un OBIETTIVO nella risoluzione di problemi?,la funzione che genera i successori,il primo stato da cui parte la ricerca,una condizione desiderata espressa in termini di situazione (ed eventualmente prestazione),c,flashcard_ia,L'obiettivo è la condizione-bersaglio. Scambiarlo per lo stato iniziale o per la funzione successore significa confondere il DOVE arrivare con il DA DOVE partire e il COME muoversi.
303,9,1,soluzione_ricerca,Cos'è una SOLUZIONE nella ricerca nello spazio degli stati?,l'insieme di tutti gli stati esplorati,un percorso (sequenza di azioni) dallo stato iniziale a uno stato obiettivo,"un qualunque stato che soddisfa il test obiettivo, ignorando il cammino",b,flashcard_ia,"La soluzione è il PERCORSO, non solo il traguardo: conta la sequenza di azioni. «Lo stato finale e basta» è l'errore di chi salta il concetto di cammino."
304,9,1,problema_tupla_4,Da quali 4 elementi è formalmente definito un problema di ricerca?,"nodi, archi, radice, foglie","stati, euristica, frontiera, insieme esplorato","stato iniziale, funzione successore, test obiettivo, funzione di costo del cammino",c,flashcard_ia,"La tupla è ⟨stato iniziale, funzione successore, test obiettivo, costo del cammino⟩. L'euristica NON c'è (siamo nel cieco), e frontiera/insieme esplorato sono dell'algoritmo, non della definizione del problema."
305,9,1,stato_iniziale,Cosa cattura lo STATO INIZIALE nella definizione formale di un problema?,la condizione da raggiungere,la situazione da cui parte la computazione della soluzione,il numero di successori di ogni nodo,b,flashcard_ia,Stato iniziale = punto di partenza. Chi lo scambia per «la condizione da raggiungere» ha invertito partenza e obiettivo.
306,9,1,funzione_successore,Cosa fa la FUNZIONE SUCCESSORE?,assegna un costo al cammino,verifica se lo stato è un goal,"dato uno stato e un'azione legale, restituisce lo stato raggiunto, generando i nodi figli",c,flashcard_ia,"La successore genera i figli applicando le azioni legali. Verificare il goal è il test obiettivo, assegnare costi è la funzione di costo: tre funzioni diverse."
307,9,1,test_obiettivo,Cosa fa il TEST OBIETTIVO?,ordina la frontiera per costo,determina se lo stato corrente è un goal (per proprietà o per appartenenza all'insieme target),genera i successori di uno stato,b,flashcard_ia,"Il test obiettivo dice solo «sei arrivato?». Generare successori è della funzione successore, ordinare la frontiera è la strategia. Ogni funzione al suo posto."
308,9,1,funzione_costo_cammino,Cosa fa la FUNZIONE DI COSTO DEL CAMMINO?,"assegna un costo numerico a un percorso, permettendo di cercare la soluzione a costo minimo",stima la distanza dal goal,conta i nodi tenuti in memoria,a,flashcard_ia,"Il costo del cammino serve a confrontare percorsi e trovare l'ottimo. Contare i nodi è la complessità spaziale; stimare la distanza dal goal è l'euristica, che qui non esiste."
309,9,1,astrazione_stati_azioni,Cosa si intende per ASTRAZIONE di stati e azioni?,rappresentare ogni dettaglio della realtà senza perdite,"rappresentare solo l'informazione e gli aspetti funzionali rilevanti alla soluzione, scartando il resto",usare stati continui invece che discreti,b,flashcard_ia,"Astrarre = tenere il rilevante (la posizione sì, il panorama no) e buttare il resto. «Ogni dettaglio senza perdite» è l'opposto dell'astrazione."
310,9,1,toy_vs_real_ch2,Qual è la differenza tra toy problem e real-world problem?,"il toy problem è artificiale, con formulazione precisa, utile per confrontare metodi; il real-world è concreto e complesso",il toy problem è più difficile da risolvere del real-world,sono la stessa cosa con nomi diversi,a,flashcard_ia,"Il toy problem mette alla prova i metodi con una formulazione netta (aspirapolvere, 8-puzzle); il real-world è il mondo vero. Non è più difficile del reale e non sono sinonimi."
311,9,1,mondo_aspirapolvere,Come è formulato il toy problem del mondo dell'aspirapolvere?,8 regine da disporre su una scacchiera,una griglia 3×3 con 8 tessere e uno spazio vuoto,"due stanze che possono essere sporche o pulite, un aspirapolvere in una di esse; azioni: sinistra, destra, aspira",c,flashcard_ia,"Aspirapolvere: 2 stanze (sporche/pulite) e le azioni S/D/A. La griglia 3×3 è l'8-puzzle, le regine sono un altro problema: non mescolare i toy problem."
312,9,1,otto_puzzle,Come è formulato il gioco dell'8 (8-puzzle)?,due stanze con un aspirapolvere,griglia 3×3 con 8 tessere numerate e uno spazio vuoto; 9!/2 = 181.440 stati raggiungibili,"un uomo che traghetta lupo, pecora e cavolo",b,flashcard_ia,"8-puzzle: 3×3, 8 tessere più il vuoto, 181.440 stati (metà delle 9! permutazioni). Le altre opzioni sono l'aspirapolvere e il capra-cavolo-lupo."
313,9,1,otto_regine,Qual è il problema delle 8 regine?,spostare 8 dischi tra tre pioli,attraversare un fiume con missionari e cannibali,"disporre 8 regine su una scacchiera 8×8 così che nessuna ne attacchi un'altra (riga, colonna, diagonale)",c,flashcard_ia,"8 regine = nessuna attacca le altre su riga/colonna/diagonale. Gli 8 dischi sono la Torre di Hanoi, missionari e cannibali un altro classico."
314,9,1,albero_ricerca,Cos'è un ALBERO DI RICERCA?,l'insieme degli stati goal,"una struttura dati in cui ogni nodo è uno stato, i figli si generano con la funzione successore e ogni nodo punta al genitore",una coda FIFO di azioni,b,flashcard_ia,L'albero di ricerca organizza gli stati generati (nodi con puntatore al parent). Non è l'insieme dei goal né una coda: la coda semmai è la frontiera.
315,9,1,albero_vs_grafo,Quando un albero di ricerca diventa un GRAFO di ricerca?,"quando lo stesso stato è raggiungibile tramite più percorsi diversi, quindi appare in più nodi",quando si usa una coda a priorità,quando il branching factor è infinito,a,flashcard_ia,Albero → grafo quando lo stesso STATO (non lo stesso nodo) si raggiunge da più cammini. Branching infinito e coda a priorità non c'entrano con questa distinzione.
316,9,1,grafo_ricerca_formale,Come è definito formalmente un grafo di ricerca?,"G = ({n_i}, {e_ij}): un insieme di nodi e uno di archi, dove e_pq indica un arco da n_p a un suo successore n_q",una sequenza lineare di stati senza archi,un albero binario bilanciato,a,flashcard_ia,"Il grafo è la coppia nodi+archi, con archi che collegano stati ai successori. Non è una sequenza lineare né per forza un albero binario."
